policy_id,title,sector,region,year,target_group,status,budget (₹ crore),summary,full_text
H001,National Health Mission (NHM),Health,All India,2013,"Rural population, women, children",Implemented,37000,Umbrella program integrating NRHM & NUHM for better healthcare access,"The NHM aims to strengthen healthcare delivery by improving rural and urban health services, maternal & child health, and communicable disease control."
H002,Ayushman Bharat (PM-JAY),Health,All India,2018,Poor & vulnerable families,Implemented,6400,Provides health insurance coverage up to ₹5 lakh per family,"Ayushman Bharat is the world's largest government-funded healthcare scheme, covering secondary & tertiary hospitalization for 50 crore citizens."
H003,Polio Eradication Initiative,Health,All India,1995,Children under 5,Completed,500,Nationwide vaccination drive to eradicate polio,"India launched the Pulse Polio Immunization campaign with free polio drops, leading to India being declared polio-free in 2014."
H004,Janani Suraksha Yojana (JSY),Health,All India,2005,Pregnant women,Ongoing,2000,Promotes institutional deliveries to reduce maternal mortality,"JSY provides financial incentives to pregnant women to deliver in healthcare facilities, ensuring safe childbirth and postnatal care."
H005,National Mental Health Programme,Health,All India,1982,General population,Under Review,500,"Focus on mental health awareness, care facilities, and training","The NMHP aims to integrate mental health into general healthcare, establish psychiatric units in hospitals, and train medical officers in mental health."
H006,National Tuberculosis Elimination,Health,All India,2017,TB patients,Implemented,3000,Goal to eliminate TB in India by 2025,"This policy strengthens early detection, free treatment, nutritional support, and digital tracking of TB cases."
H007,Mission Indradhanush,Health,All India,2014,"Children, pregnant women",Implemented,1500,Immunization drive to cover all children against preventable diseases,Mission Indradhanush aims to increase full immunization coverage to at least 90% by targeting children under 2 years and pregnant women.
